{
  "$schema": "https://json-schema.org/draft/2020-12/schema",
  "$id": "https://raw.githubusercontent.com/axiom-dotfiles/community-setups/main/schema/setup.schema.json",
  "title": "axiom community setup",
  "description": "setups/<id>/setup.json: what the gallery shows about a setup. Its config is config.json beside it.",
  "type": "object",
  "additionalProperties": false,
  "required": ["title", "author", "description", "tags", "tested", "fonts"],
  "properties": {
    "$schema": { "type": "string" },
    "title": {
      "type": "string",
      "minLength": 2,
      "maxLength": 40,
      "description": "Its name in the gallery."
    },
    "author": {
      "type": "string",
      "pattern": "^[A-Za-z0-9](?:[A-Za-z0-9-]{0,38})$",
      "description": "Your GitHub handle, without the @. Only you (or a maintainer) can update the setup."
    },
    "description": {
      "type": "string",
      "minLength": 10,
      "maxLength": 140,
      "description": "One line: what it looks like, or what it's for."
    },
    "about": {
      "type": "string",
      "maxLength": 2000,
      "description": "Optional, Markdown: the idea behind it, its inspiration, tips for using it."
    },
    "tags": {
      "type": "array",
      "minItems": 1,
      "maxItems": 6,
      "uniqueItems": true,
      "description": "From a fixed list, so the gallery's filters stay useful. Ask in an issue for a new one.",
      "items": {
        "enum": [
          "dark", "light",
          "minimal", "dense", "colorful", "monochrome",
          "floating", "docked", "vertical", "sidebar", "multi-bar",
          "pills", "powerline", "outline", "transparent", "glass",
          "rounded", "sharp", "retro",
          "laptop", "ultrawide", "multi-monitor",
          "keyboard-driven", "dock"
        ]
      }
    },
    "tested": {
      "type": "array",
      "minItems": 1,
      "uniqueItems": true,
      "description": "The compositors you ran it on.",
      "items": { "enum": ["hyprland", "niri", "sway"] }
    },
    "fonts": {
      "type": "array",
      "uniqueItems": true,
      "maxItems": 6,
      "description": "Font families it uses, the config's Appearance.font.family included. Users without one see a fallback.",
      "items": { "type": "string", "minLength": 1, "maxLength": 80 }
    },
    "wallpaper": {
      "type": "object",
      "additionalProperties": false,
      "required": ["license", "source"],
      "description": "Only with a wallpaper file. Users choose whether to use it.",
      "properties": {
        "license": {
          "type": "string",
          "minLength": 2,
          "maxLength": 60,
          "description": "SPDX id (CC0-1.0, CC-BY-4.0, …), or \"own\" for your own work shared under this repo's license."
        },
        "source": {
          "type": "string",
          "pattern": "^(https://\\S+|own)$",
          "description": "Where it comes from (https URL), or \"own\"."
        },
        "credit": {
          "type": "string",
          "maxLength": 100,
          "description": "Optional: the artist, as they want to be credited."
        }
      }
    }
  }
}
