{
  "title": "Test: Harbor Night",
  "author": "travishepworth",
  "description": "TEMPORARY test setup for axiom's gallery: big pills, a bundled palette and a wallpaper",
  "about": "Made by a script to test the catalog and axiom's gallery. **Will be removed.**",
  "tags": [
    "dark",
    "pills",
    "floating"
  ],
  "tested": [
    "hyprland"
  ],
  "fonts": [
    "Inter"
  ],
  "wallpaper": {
    "license": "own",
    "source": "own",
    "credit": "generated"
  }
}