{
  "title": "Big Pills Expanded",
  "author": "travishepworth",
  "description": "Test e2e lkjasdlfkjasdflkjasdflkjasdflkjasdflkajsdflkajsdflkasjdflkajsdflkasjdflkajsdflkajsdflkajsdflkjasdflkj",
  "tags": [
    "dark"
  ],
  "tested": [
    "hyprland",
    "niri",
    "sway"
  ],
  "fonts": [
    "Inter"
  ]
}
